guid,manager_name,category,priority,language,summary,assigned_at
136d32a0-bafd-f011-8406-0022481ba51f,Менеджер 14,Мошеннические действия,10,RU,"Клиент сообщает о задержке перевода 200 EUR и обвиняет компанию в мошенничестве, угрожая подать заявление в правоохранительные органы, если деньги не будут зачислены в течение 24 часов. Рекомендация: Необходимо срочно проверить статус перевода и предоставить клиенту ответ в кратчайшие сроки, чтобы избежать эскалации ситуации.",2026-02-22T07:14:55.696132+00:00
12e4eafd-8cec-f011-8406-0022481ba388,Менеджер 45,Консультация,3,RU,"Клиент запрашивает информацию о том, с каких банков граждане России могут пополнить свой брокерский счет. Рекомендация: предоставить подробную информацию о доступных способах пополнения счета для граждан России.",2026-02-22T07:14:55.696132+00:00
117af0c4-cb00-f111-8407-0022481ba51f,Менеджер 22,Смена данных,9,RU,Пользователь требует удалить свои персональные данные и прекратить любые звонки и смс. Рекомендация: Обработать запрос на удаление данных и подтвердить пользователю выполнение его просьбы.,2026-02-22T07:14:55.696132+00:00
0d88166d-ef0a-f111-8406-0022481ba139,Менеджер 48,Консультация,3,RU,"Клиент запрашивает справки по движению средств за 2025 год для налогового отчета. Рекомендация: предоставить информацию о том, как можно получить эти справки.",2026-02-22T07:14:55.696132+00:00
0d4df5b6-4e74-f011-b4cd-002248c8b95d,Менеджер 42,Консультация,3,RU,"Клиент интересуется возможностью открытия виртуальной Invest Card и процессом её получения, имея брокерский счёт и будучи резидентом РФ. Рекомендация: предоставить информацию о процессе открытия виртуальной Invest Card и условиях для резидентов РФ.",2026-02-22T07:14:55.696132+00:00
0d1bad00-f0ee-f011-8406-0022481bad7e,Менеджер 17,Консультация,5,RU,"Клиент хочет восстановить доступ к зарубежному счету, так как в личном кабинете виден только рублевый счет. Рекомендация: предоставить информацию о процессе восстановления доступа к зарубежным счетам.",2026-02-22T07:14:55.696132+00:00
08afc1f5-ebfd-f011-8406-0022481ba654,Менеджер 15,Консультация,3,ENG,The customer is inquiring about the absence of Uzbekistan in the country list for services. Recommendation: Provide clarification on the country eligibility criteria and inform the customer about any potential options for Uzbekistan citizens.,2026-02-22T07:14:55.696132+00:00
03e27d30-12fd-f011-8406-0022481ba654,Менеджер 14,Консультация,5,RU,Клиент предлагает идею автоматического списания денег с текущих счетов на брокерские счета и интересуется возможностью настройки такого процесса. Рекомендация: Рассмотреть предложение и предоставить информацию о текущих возможностях автоматического списания средств.,2026-02-22T07:14:55.696132+00:00
027ec97a-8e03-f111-8407-0022481bad7e,Менеджер 47,Смена данных,5,KZ,"Пользователь запрашивает информацию о правильности документа, подтверждающего его адрес, который указан в коммунальных платежах. Рекомендация: уточнить у пользователя, какие именно изменения или подтверждения ему необходимы для дальнейшей помощи.",2026-02-22T07:14:55.696132+00:00
