guid,manager_name,category,priority,language,summary,assigned_at
a1bdb65a-10ed-f011-8406-0022481ba139,Менеджер 44,Неработоспособность приложения,7,RU,"Пользователь сообщает о проблеме с продажей или конвертацией рублей в доллары США, получая ошибку. Рекомендация: Провести технический анализ проблемы и предоставить пользователю решение или информацию о времени устранения неполадок.",2026-02-22T07:14:55.696132+00:00
a1b3c016-35f1-f011-8406-0022481ba303,Менеджер 34,Спам,1,RU,"Пользователь отправил сообщение с непонятным текстом и тикерами акций, что может указывать на спам. Рекомендация: Игнорировать и не отвечать на это сообщение.",2026-02-22T07:14:55.696132+00:00
a154a8e6-439d-4a7b-86e8-56ef94b18ee2,Менеджер 42,Неработоспособность приложения,7,RU,"Клиент сообщает о неправильных показателях динамики бумаг и интересуется, когда это будет исправлено. Рекомендация: Провести проверку данных и исправить ошибки в показателях как можно скорее.",2026-02-22T07:14:55.696132+00:00
a1418c42-65f0-f011-8406-0022481ba139,Менеджер 11,Консультация,3,RU,Клиент запрашивает информацию о процессе выпуска карты и выборе счета для этого. Рекомендация: предоставить подробные инструкции по выпуску карты и выбору счета.,2026-02-22T07:14:55.696132+00:00
a13e7fb8-ebf2-f011-8406-0022481ba15f,Менеджер 48,Смена данных,7,RU,Клиент не может пройти проверку адреса проживания и не получает справку по месту жительства. Рекомендация: предложить клиенту альтернативные способы подтверждения адреса или связаться с поддержкой для решения проблемы.,2026-02-22T07:14:55.696132+00:00
a0ae4ed4-c6c5-f011-bbd3-002248c772eb,Менеджер 44,Консультация,3,RU,Клиент запрашивает выписку по брокерскому счету. Рекомендация: предоставить необходимую информацию о выписке и процессе её получения.,2026-02-22T07:14:55.696132+00:00
a03bf9b6-f0f1-f011-8406-0022481ba139,Менеджер 43,Смена данных,5,KZ,"Пользователь сообщает о наличии ошибки в документах и спрашивает, что ему делать. Рекомендация: Предложить пользователю инструкции по исправлению ошибок в документах.",2026-02-22T07:14:55.696132+00:00
9c0a1f1e-6702-f111-8407-0022481ba15f,Менеджер 44,Консультация,3,RU,Клиент запрашивает номер налогоплательщика компании для уведомления налогового органа об открытии иностранного счета. Рекомендация: предоставить необходимую информацию клиенту.,2026-02-22T07:14:55.696132+00:00
9aa08acc-f0f4-f011-8406-0022481ba15f,Менеджер 31,Консультация,1,RU,"Клиент интересуется, проводит ли компания обзвон клиентов с предложением инвестировать и есть ли программа с наставниками. Рекомендация: предоставить информацию о текущих предложениях и программах для клиентов.",2026-02-22T07:14:55.696132+00:00
99bb6f49-6107-f111-8407-0022481ba516,Менеджер 48,Смена данных,8,RU,"Клиент сообщает о блокировке счета из-за отсутствия свидетельства о рождении, хотя он уже отправил скан документа в поддержку. Ситуация вызывает недовольство клиента, так как блокировка произошла несмотря на предоставление необходимых данных. Рекомендация: Убедиться, что скан свидетельства о рождении был получен и обработан, и предоставить клиенту обновленную информацию о статусе его счета.",2026-02-22T07:14:55.696132+00:00
98e7f149-08f1-f011-8406-0022481bac13,Менеджер 26,Консультация,3,RU,The customer is inquiring whether the registration address from their Russian passport can be used as proof of address for Freedom Broker registration. They are also asking for advice on acceptable documents if it cannot be used. Рекомендация: Ответить на запрос с информацией о допустимых документах для подтверждения адреса.,2026-02-22T07:14:55.696132+00:00
97f7f33e-f40a-f111-8407-0022481ba2e6,Менеджер 8,Мошеннические действия,9,RU,"Пользователь сообщает о мошеннических действиях, связанных с использованием логотипов Freedom Finance и представлением себя сотрудниками Freedom Academy. Рекомендуется провести расследование и принять меры по блокировке таких действий и информированию пользователей о возможных рисках.",2026-02-22T07:14:55.696132+00:00
96cdaf35-5001-f111-8407-0022481ba51f,Менеджер 24,Консультация,5,KZ,"Пользователь из Узбекистана хочет открыть аккаунт на платформе Freedom, но не может найти свою страну в списке при регистрации. Он запрашивает информацию о возможности открытия аккаунта и необходимых шагах для этого. Рекомендация: предоставить пользователю информацию о процессе регистрации для граждан Узбекистана и возможные альтернативы.",2026-02-22T07:14:55.696132+00:00
95fa0bd7-5e04-f111-8407-0022481ba654,Менеджер 25,Смена данных,5,RU,"Клиент запрашивает информацию о том, как подтвердить свое проживание, так как у него нет других документов, кроме одного. Рекомендация: Предоставить клиенту информацию о возможных способах подтверждения проживания и необходимых документах.",2026-02-22T07:14:55.696132+00:00
937a62a3-160b-f111-8407-0022481ba388,Менеджер 48,Консультация,5,RU,"Клиент сообщает о проблеме с пополнением счета через Цифра банк, деньги не поступили на счет и запрашивает помощь в решении ситуации. Рекомендация: предложить клиенту проверить статус транзакции и, если необходимо, обратиться в банк для уточнения информации.",2026-02-22T07:14:55.696132+00:00
9239c033-23f2-f011-8406-0022481ba654,Менеджер 18,Смена данных,5,RU,"Клиент запрашивает закрытие своего счёта, так как он больше не нужен. Рекомендация: Обработать запрос клиента на закрытие счёта в соответствии с внутренними процедурами.",2026-02-22T07:14:55.696132+00:00
8e01ebd5-3706-f111-8407-0022481ba51f,Менеджер 1,Неработоспособность приложения,8,RU,Пользователь не может войти в аккаунт из-за проблем с верификацией и получением SMS-кода. Также возникают ошибки с номером паспорта при попытке смены пароля. Рекомендация: провести технический анализ проблемы и предоставить пользователю инструкции по восстановлению доступа к аккаунту.,2026-02-22T07:14:55.696132+00:00
8de250d3-eef5-f011-8406-0022481bac13,Менеджер 47,Мошеннические действия,8,RU,"Пользователь запрашивает проверку подлинности сертификата и людей, подозревая мошенничество. Рекомендация: Необходимо провести проверку и предоставить пользователю информацию о подлинности сертификата и сотрудников.",2026-02-22T07:14:55.696132+00:00
8d45089f-a3f6-f011-8406-0022481ba15f,Менеджер 41,Консультация,5,RU,The customer is inquiring about an email regarding blocked accounts due to outdated questionnaire data and seeks clarification on the issue. Рекомендация: Provide the customer with information on how to update their questionnaire data to prevent account blocking.,2026-02-22T07:14:55.696132+00:00
8b4183fd-80fa-f011-8406-0022481bac13,Менеджер 42,Неработоспособность приложения,9,RU,"Пользователь сообщает о проблемах с конвертацией валюты, что вызывает срочную необходимость в помощи, так как он находится за границей и не может совершать покупки. Рекомендация: Убедиться в работоспособности функции конвертации валюты и предоставить пользователю инструкции по решению проблемы.",2026-02-22T07:14:55.696132+00:00
8a17ddac-8405-f111-8407-0022481ba3d1,Менеджер 47,Консультация,5,RU,Клиент запрашивает информацию о покупке облигаций MFMOB10 по указанной цене. Рекомендация: предоставить информацию о процессе покупки облигаций и возможностях на счетах клиента.,2026-02-22T07:14:55.696132+00:00
88f7436d-d6f5-f011-8406-0022481ba046,Менеджер 47,Смена данных,5,RU,Пользователь запрашивает изменение зарегистрированного телефонного номера на новый номер. Рекомендация: Обработать запрос на изменение данных пользователя в соответствии с внутренними процедурами.,2026-02-22T07:14:55.696132+00:00
8828d0c2-10ed-f011-8406-0022481ba5f0,Менеджер 40,Консультация,3,RU,"Клиент запрашивает информацию о том, как открыть безопасную сессию. Рекомендация: предоставить подробные инструкции по открытию безопасной сессии.",2026-02-22T07:14:55.696132+00:00
86b2e6a5-3907-f111-8407-0022481ba139,Менеджер 21,Консультация,3,RU,Клиент запрашивает выписку по брокерскому счету за указанный период. Рекомендация: предоставить необходимую информацию о выписке по счету.,2026-02-22T07:14:55.696132+00:00
85c96430-f0e9-f011-8406-0022481ba51f,Менеджер 11,Неработоспособность приложения,8,RU,Пользователь не может войти в свой аккаунт из-за проблем с паролем и восстановлением через email и SMS. Рекомендация: Необходимо проверить систему восстановления пароля и обеспечить пользователю доступ к аккаунту.,2026-02-22T07:14:55.696132+00:00
84c0a8f0-2dbe-f011-bbd3-0022481ae6d4,Менеджер 45,Спам,1,KZ,"Клиент компанияға демалыс және тимбилдинг шаралары туралы шақырту хат жіберуді ұсынады, бірақ бұл хабарлама қолдау сұрауына жатпайды. Рекомендация: Хатты спам ретінде қарастырып, клиентке қолдау көрсетуге қатысты ақпарат бермеңіз.",2026-02-22T07:14:55.696132+00:00
83bd39f4-73fc-f011-8406-0022481ba5f0,Менеджер 21,Неработоспособность приложения,7,KZ,"Пользователь испытывает проблемы с верификацией, не может пройти процесс, несмотря на правильное заполнение данных. Рекомендация: Провести технический анализ проблемы и предложить пользователю альтернативные способы верификации.",2026-02-22T07:14:55.696132+00:00
82e8bd66-9603-f111-8407-0022481ba3d1,Менеджер 31,Неработоспособность приложения,8,RU,"Пользователь не может войти в свой аккаунт tradernet, несмотря на попытки смены пароля и отсутствие SMS на телефон. Возможно, аккаунт заблокирован. Рекомендация: Провести проверку состояния аккаунта и предоставить инструкции по восстановлению доступа.",2026-02-22T07:14:55.696132+00:00
82055db7-5bec-f011-8406-0022481ba303,Менеджер 44,Смена данных,5,RU,"Клиент просит завершить все деловые и договорные отношения с Freedom Broker и получить официальную справку о том, что у него отсутствуют действующие договоры и обязательства. Рекомендация: Обработать запрос клиента и подготовить необходимую документацию для завершения отношений.",2026-02-22T07:14:55.696132+00:00
80c6ed25-45f0-f011-8406-0022481ba5f0,Менеджер 17,Неработоспособность приложения,8,RU,"Пользователь не может зарегистрироваться в приложении Freedom Broker, получая ошибку на первом шаге ввода почты и пароля. Рекомендация: проверить технические проблемы с регистрацией через VPN и предложить альтернативные способы входа или регистрации.",2026-02-22T07:14:55.696132+00:00
7e77e0df-63f0-f011-8406-0022481bac13,Менеджер 45,Мошеннические действия,8,RU,"Пользователь сообщает о подозрительных денежных операциях, указывая, что у него нет таких средств. Рекомендация: Необходимо провести расследование по данному вопросу и связаться с пользователем для уточнения деталей.",2026-02-22T07:14:55.696132+00:00
7c62da2d-39ef-f011-8406-0022481ba654,Менеджер 26,Консультация,5,RU,Клиент сообщает о проблемах с верификацией KYC в Freedom Broker и запрашивает информацию о причинах отказа и необходимых действиях для повторного прохождения проверки. Рекомендация: предоставить клиенту четкие инструкции по повторной верификации и уточнить причины отказа.,2026-02-22T07:14:55.696132+00:00
7a78702f-6708-f111-8407-0022481ba51f,Менеджер 18,Мошеннические действия,10,RU,"Пользователь сообщает о получении множества смс с кодами подтверждения, что привело к взлому его аккаунта в Telegram и мошенническим действиям. Он требует удаления своих данных и запрета на отправку кодов на его номер. Рекомендация: Необходимо провести расследование по данному инциденту и предоставить пользователю официальный ответ.",2026-02-22T07:14:55.696132+00:00
79e46664-ece7-f011-8406-0022481ba51f,Менеджер 45,Неработоспособность приложения,8,RU,"Пользователь сообщает, что его личная идентификация не проходит. Рекомендация: Необходимо проверить систему идентификации и устранить возможные ошибки.",2026-02-22T07:14:55.696132+00:00
791e448d-c6ea-f011-8406-0022481ba139,Менеджер 42,Консультация,3,RU,"Клиент запрашивает информацию о том, как осуществить перевод с карты Freedom Broker на карту Цифра банка в рублях. Рекомендация: предоставить подробные инструкции по переводу и необходимые шаги для выполнения операции.",2026-02-22T07:14:55.696132+00:00
73aabcbf-55fb-f011-8406-0022481ba15f,Менеджер 33,Консультация,5,RU,"Клиент спрашивает, когда будет закрыт его счет, который был заблокирован после подачи поручения 23.01. Рекомендация: предоставить информацию о процессе закрытия счета и сроках.",2026-02-22T07:14:55.696132+00:00
73874674-f10a-f111-8407-0022481ba5f0,Менеджер 48,Неработоспособность приложения,8,RU,"Пользователь сообщает о проблеме с приложением, которое не позволяет перевести деньги между счетами, так как счета не отображаются. Рекомендация: Необходимо проверить работоспособность функции перевода между счетами и устранить проблему.",2026-02-22T07:14:55.696132+00:00
70c24622-3907-f111-8407-0022481bad7e,Менеджер 1,Консультация,3,RU,Клиент задает вопрос о процессе снятия средств. Рекомендация: предоставить подробную информацию о процедуре снятия средств и возможных сроках.,2026-02-22T07:14:55.696132+00:00
6f860ff9-cc01-f111-8407-0022481ba3d1,Менеджер 42,Претензия,9,RU,"Клиент сообщает о двойном списании комиссии в размере $25 за одну транзакцию и угрожает подать в суд. Рекомендация: Необходимо провести расследование по данному вопросу и вернуть средства клиенту, если ошибка подтвердится.",2026-02-22T07:14:55.696132+00:00
6f129f43-ecfa-f011-8406-0022481bad7e,Менеджер 48,Смена данных,5,ENG,"The customer is facing issues with account verification due to their proof of address being in Azerbaijani, which is not accepted by the system. They are seeking alternatives or a manual review of their document. Рекомендация: Рассмотреть возможность принятия альтернативных документов или ручной проверки предоставленного адресного документа.",2026-02-22T07:14:55.696132+00:00
6eee3dfb-ca00-f111-8407-0022481baec1,Менеджер 42,Консультация,3,RU,"Клиент запрашивает информацию о том, как получить справку о доходах, расходах и имуществе за 2025 год по всем закрытым счетам. Рекомендация: предоставить подробные инструкции по получению данной справки.",2026-02-22T07:14:55.696132+00:00
6e8c378f-7105-f111-8407-0022481ba2e6,Менеджер 44,Консультация,5,RU,"Клиент сообщает, что его инвестиционный счет отображается как скрытый, и он не может вывести средства. Запрашивает информацию о том, как активировать счет для вывода средств. Рекомендация: предоставить клиенту инструкции по активации счета и возможным причинам его скрытия.",2026-02-22T07:14:55.696132+00:00
6c7ecc7e-cdf2-f011-8406-0022481ba388,Менеджер 31,Неработоспособность приложения,8,RU,"Пользователь сообщает о том, что сайт Freedom Broker не открывается с 14.01.26, как на мобильной версии, так и на ПК, несмотря на стабильное интернет-соединение. Рекомендация: Провести техническую проверку сайта и уведомить пользователя о статусе решения проблемы.",2026-02-22T07:14:55.696132+00:00
690849eb-ebf2-f011-8406-0022481ba3d1,Менеджер 34,Неработоспособность приложения,8,RU,Пользователь сообщает о проблемах с входом в систему. Рекомендация: проверить технические неполадки и предоставить пользователю инструкции по восстановлению доступа.,2026-02-22T07:14:55.696132+00:00
68778e9c-0408-f111-8407-0022481ba388,Менеджер 43,Консультация,3,RU,Клиент запрашивает информацию о необходимых декларациях и сроках их подачи после торговли облигациями и акциями в Freedom Broker. Рекомендация: предоставить клиенту информацию о налоговых обязательствах и сроках подачи деклараций.,2026-02-22T07:14:55.696132+00:00
68086831-220b-f111-8407-0022481baa2c,Менеджер 23,Консультация,3,RU,Пользователь спрашивает о доступных облигациях для покупки в тенге. Рекомендация: предоставить информацию о доступных облигациях и их характеристиках.,2026-02-22T07:14:55.696132+00:00
674f0100-26f1-f011-8406-0022481ba654,Менеджер 42,Смена данных,5,RU,Клиент просит обновить свои личные данные и разблокировать брокерский счет для продажи акций. Рекомендация: Обработать запрос на изменение данных и разблокировку счета в соответствии с внутренними процедурами.,2026-02-22T07:14:55.696132+00:00
6649c4fa-a4fa-f011-8406-0022481ba4d2,Менеджер 36,Консультация,5,RU,"Клиент запрашивает информацию о том, как проверить, является ли сотрудник компании настоящим и действителен ли выданный им сертификат. Рекомендация: Предоставить клиенту информацию о том, как можно проверить сотрудников и сертификаты, а также указать на официальные каналы связи для подтверждения информации.",2026-02-22T07:14:55.696132+00:00
